{"$schema":"https://json-schema.org/draft/2020-12/schema","$id":"https://ovp.dev/schemas/ovp-run-0.1.0.json","type":"object","required":["ovp_version","run_id","input","claims","findings","disagreements","provenance"],"properties":{"ovp_version":{"const":"0.1.0"},"run_id":{"type":"string"},"input":{"type":"object","required":["type","hash"]},"claims":{"type":"array"},"findings":{"type":"array"},"disagreements":{"type":"array"},"provenance":{"type":"object","required":["verifier_version","profile","timestamp","input_hash","checker_versions","network_used","llm_used","checker_failures"]}},"additionalProperties":true}
